{
    "hypotheses": [
        {
            "summary": "The system's latent quality is healthy.",
            "confidence": 0.4,
            "evidence_for": [
                "analyst",
                "reporter",
                "comprehension"
            ],
            "evidence_against": [],
            "suspected_nodes": [
                "process",
                "coverage",
                "task",
                "ux_penalties",
                "issue_kinds",
                "issue_severity"
            ]
        }
    ],
    "next_tests": [],
    "graph_suggestions": [],
    "remediation": null,
    "provider_trace": {
        "provider": "groq",
        "model": "llama-3.1-8b-instant",
        "prompt_version": "workbench-pattern-intelligence-v1",
        "latency_ms": 611.91,
        "fallback_reason": null
    },
    "schema_version": "1.0"
}